<?xml version="1.0" encoding="UTF-8"?>
<a:authorAction xmlns:a="http://www.oxygenxml.com/ns/author/external-action"
  xmlns:xsi="http://www.w3.org/2001/XMLSchema-instance"
  xsi:schemaLocation="http://www.oxygenxml.com/ns/author/external-action http://www.oxygenxml.com/ns/author/external-action/authorAction.xsd"
  id="insert.cross.reference2">
  <a:name>${i18n(insert.cross.reference)}</a:name>
  <a:description>${i18n(insert.cross.reference_description)}</a:description>
  <a:smallIconPath href="/images/Link16.png"/>
  <a:largeIconPath href="/images/Link24.png"/>
  <a:operations>
    <a:operation id="InsertFragmentOperation">
      <a:xpathCondition>oxy:allows-child-element("*", "class", " topic/xref ")</a:xpathCondition>
      <a:arguments>
        <a:argument name="fragment"><xref>${caret}</xref></a:argument>
      </a:arguments>
    </a:operation>
  </a:operations>
  <a:enabledInReadOnlyContext>false</a:enabledInReadOnlyContext>
</a:authorAction>
