<?xml version="1.0" encoding="UTF-8"?>
<a:authorAction xmlns:a="http://www.oxygenxml.com/ns/author/external-action"
  xmlns:xsi="http://www.w3.org/2001/XMLSchema-instance"
  xsi:schemaLocation="http://www.oxygenxml.com/ns/author/external-action http://www.oxygenxml.com/ns/author/external-action/authorAction.xsd"
  id="x.fig">
  <a:name>${i18n(fig)}</a:name>
  <a:description>${i18n(fig_description)}</a:description>
  <a:operations>
    <a:operation id="ExecuteMultipleWebappCompatibleActionsOperation">
      <a:arguments>
        <a:argument name="actionIDs">done.editing
fig
</a:argument>
      </a:arguments>
    </a:operation>
  </a:operations>
  <a:accessKey>F</a:accessKey>
  <a:enabledInReadOnlyContext>false</a:enabledInReadOnlyContext>
</a:authorAction>
