<?xml version="1.0" encoding="UTF-8"?>
<a:authorAction xmlns:a="http://www.oxygenxml.com/ns/author/external-action"
  xmlns:xsi="http://www.w3.org/2001/XMLSchema-instance"
  xsi:schemaLocation="http://www.oxygenxml.com/ns/author/external-action http://www.oxygenxml.com/ns/author/external-action/authorAction.xsd"
  id="insert.new.dita.resource">
  <a:name>${i18n(insert.new.dita.resource)}</a:name>
  <a:description>${i18n(insert.new.dita.resource_description)}</a:description>
  <a:largeIconPath href="/images/NewTopic24.png"/>
  <a:smallIconPath href="/images/NewTopic16.png"/>
  <a:accessKey>N</a:accessKey>
  <a:operations>
    <a:operation id="ro.sync.ecss.extensions.dita.map.topicref.InsertNewTopicOperation">
      <a:xpathCondition>self::*[contains(@class, " map/map ") or contains(@class, " map/topicref ") or contains(@class, " map/relcell ") or contains(@class, " map/relcolspec ")]</a:xpathCondition>
    </a:operation>
  </a:operations>
</a:authorAction>
